ApplicationCloseDate,DepartmentName,JobGrade,JobSummary,MaxPay,MinPay,OfferingType,OrganizationName,PayType,PositionEndDate,PositionID,PositionLocation,PositionStartDate,PositionTitle,QualificationSummary,URI
2018-03-01,Other Agencies and Independent Organizations,SK,"The U.S. Securities and Exchange Commission is looking for the best and brightest mathematicians, data scientists, and computer scientists to volunteer alongside our team. Our mission includes advocating for investors who seek to secure a future for their family, providing guidance and regulations for the nation&#39;s securities industry in an increasingly global market, and taking action with an eye toward promoting the capital formation necessary to sustain economic growth. The SEC is seeking bright, innovative, results-oriented data science undergraduate degree students for our Student Honors Data Science Program in the Division of Economic and Risk Analysis (DERA), Washington, DC. We offer undergraduate students robust responsibilities and experiences that enhance their potential careers. Over the course of the summer program, undergraduate students will work alongside DERA staff on projects particular to the division. Students will also have the opportunity to participate in seminars/workshops, and roundtable discussions that will provide detailed information and guidance on securities regulations and laws. The Student Honors Data Science Program for undergraduate students is a six (6) month program that will tentative start in May 2018. Those selected to participate in this program should be willing and able to commit at least six (6) months to the program. The SEC will work with and accommodate those selected should academic or college credit be required to participate.",0.0000,0.0000,Internships,Securities and Exchange Commission,Without Compensation,2018-03-01,18-10086540-SHPB-DERA-LMN,"District of Columbia, District of Columbia",2017-12-01,Summer/Fall 2018 Student Honors Business Program - Data Science (Undergraduate),"All qualification requirements must be met by the closing date of this announcement. Undergraduate students must be enrolled at least half-time (6 credits per semester or the equivalent) in an accredited college or university to participate in the Student Honors Business Program. - Must be a sophomore, junior, or senior student as of June 30, 2018.
- Must be enrolled as a degree-seeking undergraduate student
- Must be taking at least half-time academic course load
- A GPA of 3.0 or higher is preferred
- Must be able to proficiently code in one or more of the following computing languages: Python, R, MATLAB, JavaScript. Knowledge of the following is considered a plus: Java, C++, SQL, ""Big Data"" languages (e.g., PigLatin)
- Relatives of current SEC employees are ineligible",https://www.usajobs.gov:443/GetJob/ViewDetails/485527800
2018-05-12,Department of Defense,IA,"JOB DESCRIPTION: Geospatial Analysts create, analyze, and interpret spatial data to support U.S. military and policymaker interests. They apply knowledge of geographic information science and technology, statistics, spatial thinking, remote sensing, intelligence issues, and the social and physical sciences to characterize events, discover relationships and trends, and produce geospatial intelligence. These analysts also conduct multi-INT research, conduct descriptive and predictive analyses, populate and exploit intelligence databases, and produce and disseminate intelligence products.",78703.0,35359.0,This is a permanent position.,National Geospatial-Intelligence Agency,Per Year,2018-05-12,20180501,"Bolling AFB, District of Columbia|Suitland, Maryland|Arnold, Missouri|Saint Louis, Missouri|Wright-Patterson AFB, Ohio|Charlottesville, Virginia|McLean, Virginia",2017-11-13,Geospatial Analyst,"MANDATORY QUALIFICATION CRITERIA: For this particular job, applicants must meet all competencies reflected under the Mandatory Qualification Criteria to include education (if required). Online resumes must demonstrate qualification by providing specific examples and associated results, in response to the announcement's mandatory criteria specified in this vacancy announcement: 1.Demonstrated experience with research and analysis preferably geospatial analysis, including use of critical thinking skills and/or data analytics designed to address international problems of national concern.
2.Strong communication and interpersonal skills, including the demonstrated ability to develop and present briefing to meet the need of various audiences.
3.Experience cultivating professional working relationships and working collaboratively to develop and leverage a network of peers and mission partners across different organizations.
4.Familiarity with technical skills, such as scripting and coding, programming, data mining and analytics, data visualization, statistical analysis, algorithm development, data science, imagery analysis, or computational thinking.
5.Working knowledge of geospatial information systems. EDUCATION REQUIREMENT: A. Education: Bachelor's degree in Cartography, Geography, Geographic Information Systems, Physical Science, Applied Mathematics, Statistics, Computer Science, or a related discipline or a Bachelor's degree in any discipline with a certificate in GIS from an accredited university. -OR- B. Combination of Education and Experience: A minimum of 24 semester (36 quarter) hours of coursework in GIS, spatial analysis, or any area listed in option A plus additional experience that demonstrates the ability to successfully perform the duties associated with this work. As a rule, every 30 semester (45 quarter) hours of college work is equivalent to one year of experience. Candidates should show that their combination of education and experience totals 4 years. -OR- C. Experience: Six years of significant applied experience in a geospatial analysis field that includes the use of current GIS tools, methods of research and analysis, application of cartographic principles, and work related to the fields listed above. PHYSICAL REQUIREMENT: Distinguish principal colors and shades/hues of principal colors; Near visual acuity of 20/20 or better with or without corrective lenses; Stereopsis ability; Far visual acuity of 20/30 or better binocular with or without corrective lenses DESIRABLE QUALIFICATION CRITERIA: In addition to the mandatory qualifications, experience in the following is desired: 1.Demonstrated ability to produce high quality written reports and or analytical products within scheduled timelines that meet customer needs.
2.Demonstrated experience with Geospatial Intelligence and/or intelligence processes, especially those in Geospatial intelligence organizations.
3.Proficiency with geospatial modeling, data management, analysis processes, imagery analysis and geospatial information systems.
4.Proven usage of statistical analysis for detailed analytics, code development and its application for automating processes.",https://www.usajobs.gov:443/GetJob/ViewDetails/484276500
2017-12-30,Department of Defense,IA,"JOB DESCRIPTION: Bathymetrists receive, analyze, and deconflict U.S. and foreign bathymetric data for use by the Intelligence Community (IC) and external customers. They populate and maintain data and metadata in the bathymetry database, ensuring the accuracy of metadata pertaining to collection source platforms and depth recording devices. They also provide customers with conflated and corrected mission-specific data.",71724.0,40956.0,This is a permanent position.,National Geospatial-Intelligence Agency,Per Year,2017-12-30,20180484,"Saint Louis, Missouri",2017-11-29,Bathymetrist,"MANDATORY QUALIFICATION CRITERIA: For this particular job, applicants must meet all competencies reflected under the Mandatory Qualification Criteria to include education (if required). Online resumes must demonstrate qualification by providing specific examples and associated results, in response to the announcement's mandatory criteria specified in this vacancy announcement: 1) Experience performing data manipulation, feature extraction, and attribution of bathymetric data independently;
2) Experience taking acquired Bathymetric/Hydrographic materials and Maritime safety source information; and evaluate it for updating existing navigational products;
3) Experience utilizing GIS knowledge and skills to evaluate and release Bathymetric data for existing navigational products also mission specific data sets and graphics tailored to specific customer needs;
4) Experience work independently or in a team environment in support of mission requirements and success. EDUCATION REQUIREMENT: A. Education: Bachelor's degree in Geography, Geology, Hydrography, Hydrology, Marine Sciences, Oceanography, Physical Science, Remote Sensing, or a related discipline, or, a Bachelor's degree with 30 semester hours of coursework in the above disciplines. Designation as an American Congress on Surveying and Mapping-The Hydrographic Society of America (ACSM-THSOA) Certified Hydrographer is highly desired. -OR- B. Combination of Education and Experience: A minimum of 30 semester (45 quarter) hours of coursework in any area list in option A, plus experience that demonstrates the ability to successfully perform the duties associated with this work. As a rule, every 30 semester (45 quarter) hours of college work is equivalent to one year of experience. Candidates should show that their combination of education and experience totals 4 years. -OR- C. Experience: Six years of experience in the disciplines of Hydrography or Bathymetry that includes marine surveying, the use of current GIS tools, methods of research and analysis, application of hydrographic or bathymetric principles, or work related to the disciplines listed above.DESIRABLE QUALIFICATION CRITERIA: In addition to the mandatory qualifications, experience in the following is desired: 1) IHO Cat B or higher certification with Maritime navigation experience using NGA related products;
2) Experience coordinating with customers and providers of bathymetric source data to develop clear, realistic product and service requests.
3) Experience creating bathymetrically enhanced geospatial graphical displays and textual reports;
4) Experience merging geospatial data and maritime safety information;
5) Experience utilize critical thinking and problem solving skills to recommend process and tool improvement methodologies.",https://www.usajobs.gov:443/GetJob/ViewDetails/485504000
2018-03-03,Department of Defense,IA,"JOB DESCRIPTION: Bathymetrists receive, analyze, and deconflict U.S. and foreign bathymetric data for use by the Intelligence Community (IC) and external customers. They populate and maintain data and metadata in the bathymetry database, ensuring the accuracy of metadata pertaining to collection source platforms and depth recording devices. They also provide customers with conflated and corrected mission-specific data.",78703.0,40956.0,This is a permanent position.,National Geospatial-Intelligence Agency,Per Year,2018-03-03,20180512,"Saint Louis, Missouri|Springfield, Virginia",2017-12-18,Bathymetrist,"MANDATORY QUALIFICATION CRITERIA: For this particular job, applicants must meet all competencies reflected under the Mandatory Qualification Criteria to include education (if required). Online resumes must demonstrate qualification by providing specific examples and associated results, in response to the announcement's mandatory criteria specified in this vacancy announcement: 1) Experience performing data manipulation, feature extraction, and attribution of bathymetric data independently;
2) Experience taking acquired Bathymetric/Hydrographic materials and Maritime safety source information; and evaluate it for updating existing navigational products;
3) Experience utilizing GIS knowledge and skills to evaluate and release Bathymetric data for existing navigational products also mission specific data sets and graphics tailored to specific customer needs;
4) Experience work independently or in a team environment in support of mission requirements and success. EDUCATION REQUIREMENT: A. Education: Bachelor's degree in Geography, Geology, Hydrography, Hydrology, Marine Sciences, Oceanography, Physical Science, Remote Sensing, or a related discipline, or, a Bachelor's degree with 30 semester hours of coursework in the above disciplines. Designation as an American Congress on Surveying and Mapping-The Hydrographic Society of America (ACSM-THSOA) Certified Hydrographer is highly desired. -OR- B. Combination of Education and Experience: A minimum of 30 semester (45 quarter) hours of coursework in any area list in option A, plus experience that demonstrates the ability to successfully perform the duties associated with this work. As a rule, every 30 semester (45 quarter) hours of college work is equivalent to one year of experience. Candidates should show that their combination of education and experience totals 4 years. -OR- C. Experience: Six years of experience in the disciplines of Hydrography or Bathymetry that includes marine surveying, the use of current GIS tools, methods of research and analysis, application of hydrographic or bathymetric principles, or work related to the disciplines listed above. PHYSICAL REQUIREMENT: Distinguish principal colors and shades/hues of principal colors; Near visual acuity of 20/20 or better with or without corrective lenses; Far visual acuity of 20/60 or better binocular with or without corrective lenses.DESIRABLE QUALIFICATION CRITERIA: In addition to the mandatory qualifications, experience in the following is desired: 1) IHO Cat B or higher certification with Maritime navigation experience using NGA related products;
2) Experience coordinating with customers and providers of bathymetric source data to develop clear, realistic product and service requests.
3) Experience creating bathymetrically enhanced geospatial graphical displays and textual reports;
4) Experience merging geospatial data and maritime safety information;
5) Experience utilizing critical thinking and problem solving skills to recommend process and tool improvement methodologies.",https://www.usajobs.gov:443/GetJob/ViewDetails/486894700
2017-12-29,Department of Agriculture,GS,"If selected for the: Resource&amp; Rural Economics Division(RRED), you will improve data acquisition and processing forthe farm business and farm household income forecast; or you will have responsibility for coordinating an annual field-level survey of farm production practices, input use, and costs. You will assist other economists with research studies and synthesize current data and research for a broad stakeholder audience. Market&amp; Trade Economics Division (MTED), you will serve as a situation and outlook analyst. You will assist in the creation and dissemination of Situation and Outlook newsletters and annual yearbooks; perform analytical assignments that maintain and support the ERS market outlook program while advancing an understanding of crop and livestock markets; and review economic and industry-related literature to support economic analysis of market issues. Food Economics Division (FED), you will work with a senior economist on economic analyses of USDA food assistance programs that utilize large program administrative data files and national surveys. You will also assist in preparation of data visualizations, literature reviews, and drafting sections of research reports.IMPORTANT INFORMATION CONCERNING OPEN CONTINUOUS ANNOUNCEMENTS This open continuous announcement will be used to fill vacancieswithin multiple divisions.
To receive consideration, applicants must submit complete applications prior to the established cut-off date(s). An initialcut-off will take place October 6, 2017 to begin initial applicant consideration.Additional cut-off dates will occur every 30 calendar days thereafterthrough December 29, 2017. Candidates for the position who submit a completed application by 11:59 PM Eastern Time on October 6, 2017, will be reviewed and referred if found eligible and qualified. This announcement will remain open until the closing date indicated; however, those who apply after the cut-off date will be considered for referral to the hiring manager only if additional vacancies occur and/or the initial referral list is exhausted. Applicants must recertify (i.e. update/resubmit their application through USAJobs) every 30 calendar days from date of application/certification to continue to receive consideration for the position(s). Applicants who fail to do so will not be reviewed and referred and be dropped from consideration.",71467.0,54972.0,Permanent,Economic Research Service,Per Year,2017-12-29,ERS-S17N-0018,"Washington DC, District of Columbia",2017-09-18,Agricultural Economist,"Applicants must meet all qualifications and eligibility requirements by the closing date of the announcement including the following specialized experience and/or education, as identified by grade level.
In order to be found minimally qualified, you must meet both the following basic education requirement AND the specialized experience requirement.BASIC REQUIREMENTS: A full 4-year course of study in an accredited college or university leading to a bachelors or higher degree in Economics, that included at least 21 semester hours in economics and 3 semester hours in statistics, accounting, calculus.ORCombination of education and experience: courses equivalent to a major in economics, as shown above, plus appropriate experience or additional education.Specialized Experience GS-09:One year of specialized experience comparable to GS-07 which is directly related to the work of this position and which has equipped the applicant with the competencies to perform successfully the duties of the position. For this position, specialized experience is experience in gathering, analyzing, and presenting complex technical economic information using software and statistical methods and preparing analytical reports on agricultural economic issues.OR 2 years of progressively higher level graduate education leading to a master&rsquo;s degree, or a master&rsquo;s degree or equivalent graduate.ORCombination of education and experience.
Experience refers to paid and unpaid experience, including volunteer work done through National Service programs (e.g., Peace Corps, AmeriCorps) and other organizations (e.g., professional; philanthropic; religious; spiritual; community, student, social). Volunteer work helps build critical competencies, knowledge, and skills and can provide valuable training and experience that translates directly to paid employment. You will receive credit for all qualifying experience, including volunteer experience.",https://www.usajobs.gov:443/GetJob/ViewDetails/479698800
