ApplicationCloseDate,DepartmentName,JobGrade,JobSummary,MaxPay,MinPay,OfferingType,OrganizationName,PayType,PositionEndDate,PositionID,PositionLocation,PositionStartDate,PositionTitle,QualificationSummary,URI
2018-01-15,Department of the Air Force,WG,"This National Guard position is for a Nondestructive Tester, Position Description Number D2319000 and is part of the Oregon National Guard 173rd Fighter Wing, National Guard. The National Guard is the oldest component of the Armed Forces of the United States. Since the earliest American colonial days, citizens have joined together for collective defense. We have a proud tradition of coming to the aid of our friends and neighbors in times of serious emergencies. Join our National Guard team and serve your nation, your states and your community! NATIONAL GUARD MEMBERSHIP IS REQUIRED: This is an excepted service position that requires membership in a compatible military assignment in the National Guard. Selectee will be required to wear the military uniform. Acceptance of an excepted service position constitutes concurrence with these requirements as a condition of employment. Applicants who are not currently a member of the National Guard must be eligible for immediate membership and employment in the National Guard in the military grade listed in this announcement. First Area of Consideration: Current permanent Technicians full time support personnel of the Oregon Air National Guard.
Second Area of Consideration: All members of the Oregon Air National Guard.
Third Area of Consideration: Individuals in the Active Duty Air Force, Air Force Reserve or Air Force National Guard who have held/hold the AFSC and are eligible to meet the military requirements for membership in the Oregon AFNG. Individuals eligible to meet the military requirements for membership in the ANG.",30.1300,25.8400,Permanent,Air National Guard Units (Title 32/Title 5),Per Hour,2018-01-15,OR-10099901-AF-18-036,"Kingsley Field, Oregon",2017-12-15,Nondestructive Tester,"GENERAL EXPERIENCE: Work involves nondestructive examination of metals, composites, ceramics, plastics, and other materials for internal and external structural defects, delaminations, corrosion, and moisture penetration using magnetic particle, liquid penetrant, eddy current, radiographic, ultrasonic, or other types of nondestructive test processes and equipment. Experience or training which demonstrates the ability to set up and operate test equipment, use test apparatus to apply tests to material or products, record readings, observe and record established reactions, and classify according to defined categories. SPECIALIZED EXPERIENCE:
WG-11 - 18 months experience or training in using ultrasonic and/or eddy current inspection techniques to observe, measure, and detect discontinuities and flaws. Experience classifying test results, identifying material deficiencies and recommending courses of action for items of equipment. Experience recommending engine components to be inspected and forwarding results to the appropriate authority. Experience performing scheduled inspections of testing equipment ensuring compliance with established technical regulations and procedures.",https://www.usajobs.gov:443/GetJob/ViewDetails/486832300
2018-01-05,Department of the Air Force,WG,"This National Guard position is for a AIRCRAFT SURVIVAL FLIGHT EQUIPMENT REPAIRER, Position Description Number D1867 and is part of the AL 187TH Fighter Wing, National Guard. The National Guard is the oldest component of the Armed Forces of the United States. Since the earliest American colonial days, citizens have joined together for collective defense. We have a proud tradition of coming to the aid of our friends and neighbors in times of serious emergencies. Join our National Guard team and serve your nation, your states and your community! ALABAMA AIR NATIONAL GUARD MEMBERSHIP IS REQUIRED: This is an excepted service position that requires membership in a compatible military assignment in the National Guard. Selectee will be required to wear the military uniform. Acceptance of an excepted service position constitutes concurrence with these requirements as a condition of employment. Applicants who are not currently a member of the National Guard must be eligible for immediate membership and employment in the National Guard in the military grade listed in this announcement. This position is located in the Aircrew Flight Equipment Function, Air Operations Division. The position provides diagnostic, analytical, calibration, investigative research, troubleshooting, in-depth inspections, quality control inspections, certification, testing, evaluation, and maintenance or overhaul of all Aircrew Flight Equipment and aircrew chemical defense equipment. Provides formal academic classroom and technical instruction to all pilots/aircrew on all initial and continuation instruction to ensure aircrew survival ability under peacetime or combat operations. Responds and participates as an Air Force aircraft mishap board representative in investigating flight support equipment failures/malfunctions associated with mishaps. EXCEPTED POSITION: Alabama Air National Guard membership is required.
POSITION STATUS: NON-MERIT
LOCATION: 187TH FW, MONTGOMERY, AL
SELECTING OFFICIAL: SMSgt P. GORDON",30.1200,25.8300,FILL NON-MERIT,Air National Guard Units (Title 32/Title 5),Per Hour,2018-01-05,AL-10094156-17-AF-283,"Montgomery, Alabama",2017-12-05,AIRCRAFT SURVIVAL FLIGHT EQUIPMENT REPAIRER,"GENERAL EXPERIENCE:Experience or training which demonstrates the applicants knowledge of materials and equipment used in the line of work (helmets, torso harness assemblies, parachutes, survival equipment). Ability to understand written instructions and to use reference materials and manuals.
SPECIALIZED EXPERIENCE: Do you possess at least 18 months experience in each of the following tasks: Experience or training which has demonstrated knowledge of aviation life support equipment. Experience reading and interpreting military manuals. Experience in supply procedures and property accountability. Experience collecting information and presenting it to various sized groups. Experience in planning a functional shop maintenance program is essential.
KNOWLEDGE, SKILLS, AND ABILITIES:
--Knowledge and understanding of all aircrew flight equipment and chemical/biological defense equipment utilized by the units aircrew to ensure aircrew flight equipment/ components meet airworthiness criteria, operate within specified tolerances and in the proper sequence, and are mission ready to support the requirements of day-to-day operation as well as sustained critical combat operations. --Ability to inspect, test, calibrate, certify, evaluate, troubleshoot, disassemble, repair, overhaul, assemble, replace, as necessary, and issue life support parts and equipment. --Ability to install, remove, and inspect all aircrew flight equipment on the unit aircraft. --Ability to utilize a variety of complex, state of the art diagnostic testers/systems/specialty tools to test, troubleshoot, and repair all aircrew flight equipment utilized by the unit. --Ability to perform precision soldering on flexible circuit boards to repair/replace defective parts. --Ability and certification to plan, organize, develop, direct, implement, conduct, and evaluate formal academic classroom and technical instruction on a wide variety of life support topics to provide initial and recurring training for all aircrew and passengers. --Knowledge of and ability to utilize multiple computer main frame programs/data bases. --Knowledge of materials handling, inventorying, and supply procedures to store and maintain adequate supplies of aircrew flight function parts and equipment. --Knowledge of and certification in handling, shipping, storing, and ordering multiple hazardous materials to include munitions/ammunition assets. --Skill and ability in the operation of materials handling equipment utilized in receipt, storage, and shipment of the unit life support supplies and equipment. --Ability to plan unscheduled work when detailed specifications are not available and take measurements for articles of various shapes and sizes. --Knowledge of fabrication mathematics, to include fractions, equations, and plane measurements to make problematical calculations. -- Expertise to fit items to spaces or locations with unique parameters, unusual shapes, or obstructions. --Thorough knowledge of all types of common fibers, blends, fabrics, and finishes to include a knowledge of performance and handling characteristics such as dimensional stability, abrasion resistance, and heat sensitivity, to select materials to meet particular needs. --Ability to substitute materials when the precise type or weight desired is not available.",https://www.usajobs.gov:443/GetJob/ViewDetails/485960400
