ApplicationCloseDate,DepartmentName,JobGrade,JobSummary,MaxPay,MinPay,OfferingType,OrganizationName,PayType,PositionEndDate,PositionID,PositionLocation,PositionStartDate,PositionTitle,QualificationSummary,URI
2018-01-03,Department of the Army,WG,"Civilian employees serve a vital role in supporting the Army mission. They provide the skills that are not readily available in the military, but crucial to support military operations. The Army integrates the talents and skills of its military and civilian members to form a Total Army. About the Position: This position is a TERM position. It is time-limited and may be extended up to a maximum of six years. This position may be converted to permanent career or career-conditional appointment under specific conditions. This is a developmental position. Upon meeting training, performance, and regulatory requirements, you may be non-competitively promoted through the intervening WG-6, and WG-7, to the target WG-08 position. Tooele Army Depot is located approximately 45 miles West of Salt Lake City, Utah. The Depot is in Tooele County and surrounded by the communities of Tooele, Grantsville, Stockton, and Rush Valley. The area surrounding the depot is as an urban center for a highly varied and productive agriculture industry. The depot is 42,974 acres and currently serves the missions of conventional ammunition storage, maintenance, demilitarization, and ammunition peculiar equipment. The depot was constructed in 1942 in an area with a historical tradition of Indian cultures. Originally the depot was known as the Tooele Ordnance Depot, which functioned as a storage depot for World War II supplies, ammunition, and combat vehicles. Currently, the depot has maintained the certification of ISO 9001:2000, incorporated the LEAN and Six Sigma structure, and are ready for new missions for not only the Army, but all services of Department of Defense, and partnerships with private industry. Who May Apply: US Citizens",25.0100,17.0700,1 Yr 1 Day,U.S. Army Joint Munitions Command,Per Hour,2018-01-03,WTFQ174792322814D,"Tooele Army Depot, Utah",2017-12-21,Explosives Worker (Fork Lift Operator),"Experience refers to paid and unpaid experience, including volunteer work done through National Service programs (e.g., Peace Corps, AmeriCorps) and other organizations (e.g., professional; philanthropic; religious; spiritual; community; student; social). You will receive credit for all qualifying experience, including volunteer experience. There is no specific length of training or experience required. However, you must be able to demonstrate, through experience shown in your written application materials that you possess the sufficient knowledge, skills, and abilities to successfully perform the work of this position without more than normal supervision. Minimum Qualifications (Screen Out Element): Ability to do the work of an Explosives Worker (Fork Lift Operator)~ without more than normal supervision. Experience following safe and proper methods of handling ammunition or explosives or movement/storage/verification of hazardous waste. Have operated an electric, gasoline, or diesel powered fork lift truck - Failure to meet this Screen out Element will result in an ineligible rating. Ability To Do The Work Of The position Without More Than Normal SupervisionAbility to Interpret Instructions, Specification, etc. (other than blueprints)Dexterity and SafetyKnowledge of Equipment Assembly, Installation, Repair, etc.Knowledge of MaterialsTechnical Practices (theoretical, precise, artistic)Use of Measuring Instruments Physical effort: Work involves lifting and working on production including standing, reaching, bending, stooping and manipulating carrying of items weighing up to 45 pounds lines at rhythmic pace for extended periods parts and using machines and hand tools. During fork lift operation, physical effort is required in braking and steering, manipulation of clutch, shift, lifting and tilting mechanisms. Working Conditions: Work is usually performed indoors, or outdoors in covered areas or passageways which provide some protection. Work areas are usually well lighted and ventilated. Some operations, however, such as melting powder or steaming out powder, cause uncomfortable steam or heat in the work area. Workers are required to stand on floors made of concrete, lead or conductive composition. They wear protective clothing such as specially treated coveralls, respirators and goggles on many assignments. They are frequently exposed to moisture and wet floors as a result of cleanup operations in powder working areas. They are exposed to the possibility of explosion and flash fire. There is chance of injuries ranging from loss of life or limbs to bums, cuts, bruises, sprains and nausea.",https://www.usajobs.gov:443/GetJob/ViewDetails/487017700
2018-01-08,Department of the Army,GS,"Civilian employees serve a vital role in supporting the Army mission. They provide the skills that are not readily available in the military, but crucial to support military operations. The Army integrates the talents and skills of its military and civilian members to form a Total Army. About the Position:
Tooele Army Depot is located approximately 45 miles West of Salt Lake City, Utah. The Depot is in Tooele County and surrounded by the communities of Tooele, Grantsville, Stockton, and Rush Valley. The area surrounding the depot is as an urban center for a highly varied and productive agriculture industry. The depot is 42,974 acres and currently serves the missions of conventional ammunition storage, maintenance, demilitarization, and ammunition peculiar equipment. The depot was constructed in 1942 in an area with a historical tradition of Indian cultures. Originally the depot was known as the Tooele Ordnance Depot, which functioned as a storage depot for World War II supplies, ammunition, and combat vehicles. Currently, the depot has maintained the certification of ISO 9001:2000, incorporated the LEAN and Six Sigma structure, and are ready for new missions for not only the Army, but all services of Department of Defense, and partnerships with private industry. Who May Apply: US Citizens",47598.0000,36611.0000,Permanent,U.S. Army Joint Munitions Command,Per Year,2018-01-08,WTFQ174915389907D,"Tooele Army Depot, Utah",2017-12-20,Management Assistant (Mail Clerk),"In order to qualify, you must meet the education requirements described below. Experience refers to paid and unpaid experience, including volunteer work done through National Service programs (e.g., Peace Corps, AmeriCorps) and other organizations (e.g., professional; philanthropic; religious; spiritual; community; student; social). You will receive credit for all qualifying experience, including volunteer experience. Your resume must clearly describe your relevant experience; if qualifying based on education, your transcripts will be required as part of your application. Additional information about transcripts is in this document. Specialized Experience: One year of specialized experience which includes experience maintaining paper and/or electronic records/forms records in accordance with regulations or procedures.This definition of specialized experience is typical of work performed at the next lower grade/level position in the federal service (GS-05). You will be evaluated on the basis of your level of competency in the following areas:
Customer ServiceManages and Organizes InformationWriting Some federal jobs allow you to substitute your education for the required experience in order to qualify. For this job, you must meet the qualification requirement using experience alone--no substitution of education for experience is permitted.",https://www.usajobs.gov:443/GetJob/ViewDetails/487005100
2018-01-02,Department of the Army,GS,"Civilian employees serve a vital role in supporting the Army mission. They provide the skills that are not readily available in the military, but crucial to support military operations. The Army integrates the talents and skills of its military and civilian members to form a Total Army. About the Position: Tooele Army Depot is located approximately 45 miles West of Salt Lake City, Utah. The Depot is in Tooele County and surrounded by the communities of Tooele, Grantsville, Stockton, and Rush Valley. The area surrounding the depot is as an urban center for a highly varied and productive agriculture industry. The Depot is 42,974 acres and currently serves the missions of conventional ammunition storage, maintenance, demilitarization, and ammunition peculiar equipment. The Depot was constructed in 1942 in an area with a historical tradition of Indian cultures. Originally the Depot was known as the Tooele Ordnance Depot, which functioned as a storage depot for World War II supplies, ammunition, and combat vehicles. Currently, the Depot has a maintained the certification of ISO 9001:2000, incorporated the LEAN and Six Sigma structure, and are ready for new missions for not only the Army, But all services of Department of Defense, and partnerships with private industry. Who May Apply: US Citizens",52893.0000,40684.0000,Permanent,U.S. Army Medical Command,Per Year,2018-01-02,WTDJ17459836D,"Tooele Army Depot, Utah",2017-12-22,Occupational Health Technician,"In order to qualify, you must meet the education and/or experience requirements described below. Experience refers to paid and unpaid experience, including volunteer work done through National Service programs (e.g., Peace Corps, AmeriCorps) and other organizations (e.g., professional; philanthropic; religious; spiritual; community; student; social). You will receive credit for all qualifying experience, including volunteer experience. Your resume must clearly describe your relevant experience; if qualifying based on education, your transcripts will be required as part of your application. Additional information about transcripts is in this document. To qualify based on your experience, your resume must describe at least one year of experience at the next lower grade or equivalent, GS-06. Special experienced is defined as: Responding to on-site or off-site accidents or emergencies, involving injury or illness. Qualifying experience is at the next lower grade of GS-06 or equivalent. OR Substitution of education: Successfully completed 1 full year of graduate level education or superior academic achievement in a field which demonstrates the knowledge, skills, and abilities necessary to do the work of the position, such as, Emergency Medical Technology, Cardiorespiratory, Clinical Procedures, Respiratory Care and Cardiac Arrest. (Note: You must attach a copy of your transcripts.) Superior Academic Achievement is based on: (1) Class Standing - You must be in the upper third of the graduating class in the college, university, or major subdivision, such as the College of Liberal Arts or the School of Business Administration, based on completed courses; OR (2) Grade-Point Average (G.P.A.) - You must have a grade-point average of either (a) 3.0 or higher out of a possible 4.0 (""B"" or better) as recorded on your official
transcript, or as computed based on 4 years of education, or as computed based on courses completed during the final 2 years of the curriculum; or (b) 3.5 or higher out of a possible 4.0 (""B+"" or better) based on the average of the required courses completed in the major field or the required courses in the major field completed during the final 2 years of the curriculum.; OR (3) Honor Society Membership - You may be considered eligible based on membership in one of the approved national scholastic honor societies listed by the Association of College Honor Societies (https://www.achsnatl.org/). (NOTE: You must attach a copy of your transcripts and/or verification of class standing for further verification.) OR A combination of education and experience. A combination of education and experience may be used to qualify for this position as long as the computed percentage of the requirements is at least 100%. To compute the percentage, divide your total months of qualifying experience by 12. Then, divide your semester hours of graduate education by 18. Add the two percentages. The total percentage must equal at least 100 percent to qualify. (Note: You must attach a copy of your transcripts.) You will be evaluated on the basis of your level of competency in the following areas:
ClericalOral CommunicationTechnical Competence",https://www.usajobs.gov:443/GetJob/ViewDetails/487157800
2018-03-31,Department of the Air Force,GS,"The mission of the United States Air Force is to fly, fight and win...in air, space and cyberspace. To achieve that mission, the Air Force has a vision of Global Vigilance, Reach and Power. That vision orbits around three core competencies: Developing Airmen, Technology-to-Warfighting and Integrating Operations. Core competencies and distinctive capabilities are based on a shared commitment to three core values -- integrity first, service before self, and excellence in all we do. These positions are being filled under Expedited Hiring Authority (EHA) for Defense Acquisition Workforce Positions and Health Care Occupations. The Secretary of the Air Force has delegated authority by the Office Of the Secretary of Defense to directly appoint individuals to select defense acquisition workforce positions, or &#39;EHA Acquisition,&#39; pursuant to the Defense Acquisition Workforce Improvement Act (DAWIA) and certain health care occupations, or &#39;EHA Medical.&#39; Positions are located Air Force-Wide. Positions may be filled as permanent or term with a full-time or part-time work schedule. Pay will vary by geographic location. This Public Notice is to gather applications which may or may not result in a referral or selection. This Public Notice may be used to fill positions in other equivalent pay systems (i.e., NH, NJ, NK). Please read this Public Notice in its entirety prior to submitting your application for consideration.",155073.0000,32844.0000,Multiple Appointment Types,Air Force Personnel Center,Per Year,2018-03-31,AFPC-ACQEHA-10078879-0343,"Gunter AFB, Alabama|Redstone Arsenal, Alabama|Edwards AFB, California|El Segundo, California|Vandenberg AFB, California|Peterson AFB, Colorado|Schriever AFB, Colorado|Bolling AFB, District of Columbia|Cocoa, Florida|Eglin AFB, Florida|Hurlburt Field, Florida|MacDill AFB, Florida|Patrick AFB, Florida|Scott AFB, Illinois|Barksdale AFB, Louisiana|Hanscom AFB, Massachusetts|Fort Detrick, Maryland|Fort Meade, Maryland|Whiteman AFB, Missouri|Offutt AFB, Nebraska|Kirtland AFB, New Mexico|Creech AFB, Nevada|Nellis AFB, Nevada|Wright-Patterson AFB, Ohio|Tinker AFB, Oklahoma|Dyess AFB, Texas|Goodfellow AFB, Texas|Kelly AFB, Texas|Lackland AFB, Texas|Randolph AFB, Texas|Hill AFB, Utah|Arlington, Virginia|Falls Church, Virginia|Falls Church County, Virginia|Langley AFB, Virginia|Naval Base, Norfolk, Virginia|Suffolk, Virginia|Seattle, Washington",2017-12-01,Management and Program Analysis,"SPECIALIZED EXPERIENCE:
GS-05: Three years of general experience, one year for which was equivalent to at least the GS-04 grade level in the Federal service OR four-year course of study leading to a bachelor&#39;s degree OR a combination of the experience and the education described. GS-07: One year of specialized experience, equivalent to at least the GS-05 grade level in the Federal service, which has equipped me with the particular knowledge, skills, and abilities to successfully perform the duties of the position which could include work that involved analytical research and evaluation of diversified programs; development, administration and control of assigned projects; ability to access, locate, basic design, and update information through the use of personal computer technology, OR one full year of graduate level education or superior academic achievement, OR a combination of experience and education. GS-09: One year of specialized experience equivalent to at least the GS-07 grade level in the Federal service, which has equipped me with the particular knowledge, skills, and abilities to successfully perform the duties of the position that includes work involved in analytical research and evaluation of diversified programs; development, administration and control of assigned projects; ability to access, locate, basic design, and update information through the use of personal computer technology, OR successful completion of a master&#39;s or equivalent graduate degree or 2 full years of progressively higher level graduate education leading to such a degree or LL.B. or J.D., if related OR a combination of experience and education. GS-11: One year of specialized experience equivalent to at least the GS-09 grade level in the Federal service, which has equipped me with the particular knowledge, skills, and abilities to successfully perform the duties of the position. Examples of qualifying experience included work that involved analyzing and evaluating the effectiveness of programs and operations with supervisory control; developing life cycle cost analyses of projects or performing cost benefit of current or projected programs, OR successful completion of a Ph.D. or equivalent doctoral degree or three full years of progressively higher level graduate education leading to such a degree OR a combination of experience and education. GS-12: One year of specialized experience equivalent to at least the GS-11 grade level in the Federal service, which has equipped me with the particular knowledge, skills, and abilities to successfully perform the duties of the position. Examples of qualifying experience includes work that involved analyzing and evaluating the effectiveness of programs and operations; developing life cycle cost analyses of projects or performing cost benefit or economic evaluations of current or projected programs; or that involved other work related to management and program analysis. GS-13: One year of specialized experience equivalent to at least the GS-12 grade level in the Federal service, which has equipped me with the particular knowledge, skills, and abilities to successfully perform the duties of the position. Examples of qualifying experience includes knowledge of a wide range of qualitative and quantitative methods for the assessment and improvement of critical command plans and programs for participating in or conducting major operations such as mission and flight operations, tactical airlift, tactical training, rescue, deployment, mobilization, PPBS, acquisition, special operations, exercise, foreign military sales, contingency, or similar operations GS-14: One year of specialized experience equivalent to at least the GS-13 grade level in the Federal service, which has equipped me with the particular knowledge, skills, and abilities to successfully perform the duties of the position. Examples of qualifying experience includes facilitating process improvement activities using Lean Six Sigma (LSS) and other continuous process improvement strategies; leading complex process improvement projects, including defining the customers critical factors; serving as a trainer for Lean Six Sigma courses; and mentoring Lean Six Sigma students regarding project completion. GS-15: One year of specialized experience equivalent to at least the GS-14 grade level in the Federal service, which has equipped me with the particular knowledge, skills, and abilities to successfully perform the duties of the position. Examples of qualifying experience includes conducting analyses for process improvement, improving quality, or reducing costs; establishing the appropriate metrics for measuring cost reduction and quality improvement; providing technical direction in process improvement analysis; and providing classroom instruction on Lean Six Sigma. OR
To view qualifying educational requirements and/or combination of education and specialized experience click on the following link:
https://www.opm.gov/policy-data-oversight/classification-qualifications/general-schedule-qualification-standards/#url=GS-ADMIN KNOWLEDGE, SKILLS AND ABILITIES (KSAs): Your qualifications will be evaluated on the basis of your level of knowledge, skills, abilities and/or competencies in the following areas: 1. Knowledge of analytical and evaluative methods and techniques for assessing program development or execution and improving organizational effectiveness and efficiency.
2. Knowledge of management principles and processes.
3. Skill in application of fact finding and investigative techniques.
4. Ability to communicate orally and in writing.
5. Ability to develop presentations and reports. PART-TIME OR UNPAID EXPERIENCE: Credit will be given for appropriate unpaid and or part-time work. You must clearly identify the duties and responsibilities in each position held and the total number of hours per week. VOLUNTEER WORK EXPERIENCE: Refers to paid and unpaid experience, including volunteer work done through National Service Programs (i.e., Peace Corps, AmeriCorps) and other organizations (e.g., professional; philanthropic; religious; spiritual; community; student and social). Volunteer work helps build critical competencies, knowledge and skills that can provide valuable training and experience that translates directly to paid employment. You will receive credit for all qualifying experience, including volunteer experience.",https://www.usajobs.gov:443/GetJob/ViewDetails/483952900
2018-01-02,Department of Commerce,ZP,"Incumbent will serve as Business Analyst in the Business Operations Office of the Associate Director for Management Resources (ADMR) for the National Institute of Standards and Technology in Gaithersburg, Maryland.Are you ready to explore your future with NIST?Your application package may be shared with other selecting officials at NIST with opportunities like the one you are applying to. Additional selections may be made through this vacancy. This announcement will close at 11:59 p.m. Eastern Time on the date the first 120 applications are received or December 18, 2017, whichever comes first.",145629.0,94796.0,Permanent,National Institute of Standards and Technology,Per Year,2018-01-02,ADMR-2018-0002,"Gaithersburg, Maryland",2017-12-19,"IT Specialist (Project Manager), ZP-2210-IV (GS- 13/14 Equivalent)","Basic Requirements: Experience: Experience must be IT related; the experience may be demonstrated by paid or unpaid experience and/or completion of specific, intensive training (for example, IT certification), as appropriate. IT-related experience must demonstrate:1. Attention to Detail - Is thorough when performing work and conscientious about attending to detail.2. Customer Service - Works with clients and customers (that is, any individuals who use or receive the services or products that your work unit produces, including the general public, individuals who work in the agency, other agencies, or organizations outside the Government) to assess their needs, provide information or assistance, resolve their problems, or satisfy their expectations; knows about available products and services; is committed to providing quality products and services.3. Oral Communication - Expresses information (for example, ideas or facts) to individuals or groups effectively, taking into account the audience and nature of the information (for example, technical, sensitive, controversial); makes clear and convincing oral presentations; listens to others, attends to nonverbal cues, and responds appropriately.4. Problem Solving - Identifies problems; determines accuracy and relevance of information; uses sound judgment to generate and evaluate alternatives, and to make recommendations.In addition to the basic requirements, Applicants must also have 1 year (52 weeks) of SPECIALIZED EXPERIENCE, equivalent to the GS-12 grade level in the federal service (ZP-III for NIST employees). Specialized experience is defined as the ability to align processes, systems, policies, and organizational structures with the mission and strategy of the organization and command and analyze existing workflows or develop new ones with the goal of identifying process inefficiencies and areas for improvement; Training and/or experience leading process improvement activities using Lean Six Sigma (LSS) or other continuous improvement strategies; And Experience leading enterprise-wide projects.Experience refers to paid and unpaid experience, including volunteer work done through National Service programs (e.g., Peace Corps, AmeriCorps) and other organizations (e.g., professional; philanthropic; religious; spiritual; community, student, social). Volunteer work helps build critical competencies, knowledge, and skills and can provide valuable training and experience that translates directly to paid employment. You will receive credit for all qualifying experience, including volunteer experience.Qualification requirements in the vacancy announcement are based on the U.S. Office of Personnel Management (OPM) Qualification Standards Handbook, which contains Federal qualification standards. This handbook is available on the OPM website located at http:///www.opm.gov/qualifications",https://www.usajobs.gov:443/GetJob/ViewDetails/486612500
